Com uma narrativa fluida e pesquisa profunda, Elio Gaspari compõe um painel fascinante de um país em plena ebulição, em que muitos dos protagonistas se mantêm como parte do noticiário atual. No epílogo, denominado “500 vidas”, o autor acompanha o destino de quinhentos personagens que sobreviveram ao fim da ditadura, entre militares e militantes, empresários e sindicalistas, torturados e torturadores. Alguns desses sobreviventes chegaram à presidência da República, como a presa política Dilma Rousseff, o metalúrgico Luiz Inácio Lula da Silva e o professor Fernando Henrique Cardoso. É uma conclusão impactante para uma obra fundamental sobre a história recente do Brasil.
A ditadura acabada estará disponível em duas versões de e-book, uma delas com áudios e vídeos acrescentados pelo autor, ambas contendo mais de trinta documentos históricos.
A Coleção Ditadura, com seus cinco volumes, poderá ser encontrada também em um luxuoso box em versão impressa e digital.

• Conclusão da Coleção Ditadura, que cobre todos os anos do regime militar em cinco volumes. É considerada a obra mais importante sobre o período e fundamental para a compreensão da história recente do país.
• A ditadura acabada é livro inédito de Elio Gaspari, colunista dos jornais Folha de S.Paulo e O Globo, indiscutivelmente um dos jornalistas mais influentes do Brasil.
• Pesquisa fundamentada por extensa documentação do arquivo do autor.
• Epílogo arrebatador que acompanha a trajetória de quinhentos personagens que sobreviveram à ditadura.
• E-books com mais de trinta documentos históricos. Uma das versões também contém áudios e vídeos.
• O site www.arquivosdaditadura.com.br reúne documentos do arquivo do autor e textos que iluminam episódios da vida nacional entre 1964 e 1985.
1499 : O Brasil antes de Cabral;1499 - O Brasil antes de Cabral;Se você acha que a pré-história brasileira não passou de um interminável marasmo, povoado por pequenas tribos de índios nus que viviam em ocas rudimentares e assavam lambaris no espeto para o jantar, está na hora de ler este livro. Um conjunto impressionante de novos estudos arqueológicos tem revelado que o Brasil anterior à chegada de Cabral, longe de ser um vazio primitivo, tinha populações densas, tradições artísticas vibrantes e “super-aldeias” que mais pareciam cidades em plena Amazônia. Nestas páginas, você vai acompanhar toda a saga dos primeiros povoadores deste pedaço da América do Sul, da chegada a um continente então dominado por dentes-de-sabre e tatus gigantes ao surgimento de sociedades complexas e construtoras de grandes monumentos.
Casa-Grande & Senzala;Casa-Grande & Senzala;Abordagens inovadoras de vida familiar, dos costumes públicos e privados, das mentalidades e das inter-relações étnicas revelam um painel envolvente e deliciosamente instigante da formação brasileira no período colonial. Da arquitetura real e imaginária da casa-grande e dos fluxos e refluxos do cotidiano da família patriarcal, emergiram traços da convivência feita de intimidade e dominação entre senhores e escravos e entre brancos, pretos e índios que marcaram para sempre a sociedade brasileira.
Negociando com Hitler: A desastrosa diplomacia que levou à guerra;Negociando com Hitler;E se a diplomacia tivesse conseguido parar a Segunda Guerra?
Negociando com Hitler traz uma desconhecida história dos desastrosos anos de indecisão e diplomacia cujo fracasso contribuiu para o domínio de Hitler na Europa. Com base em pesquisas em arquivos e fontes não anteriormente vistas por historiadores, Tim Bouverie cria um retrato inesquecível de políticos, aristocratas e diplomatas que, por meio de suas ações, determinaram o destino do mundo. Começando com o advento de Hitler em 1933, embarcamos em uma viagem fascinante desde os primeiros dias do Terceiro Reich até as praias de Dunquerque. Bouverie nos leva não apenas para os bastidores do parlamento e do governo inglês mas também para as salas de estar e restaurantes da decadente Grã-Bretanha imperial, onde Hitler gozou de surpreendente apoio entre a classe dominante e até mesmo alguns membros da família real.
Filosofias africanas: Uma introdução;Filosofias africanas;Filosofias africanas é uma viagem ao pensamento africano pelos ganhadores do Prêmio Jabuti – Livro do ano.

Num sentido amplo, o termo “filosofia” designa a busca do conhecimento iniciado quando os seres humanos começaram a tentar compreender o mundo por meio da razão. O termo pode também definir o conjunto de concepções, práticas ou teóricas, acerca da existência, dos seres, do ser humano e do papel de cada um no Universo. Na prática acadêmica, é usado para designar o “conjunto de concepções metafísicas (gerais e abstratas) sobre o mundo”.

A grande crítica que se faz às tentativas de caracterizar o pensamento tradicional africano como filosofia é a de que, na África, os nativos, defrontados com a grande incógnita que é o Universo, seriam incapazes de ir além do temor e da reverência, próprios das mentes ditas “primitivas”.

A partir daí, o chamado “racismo científico”, um dos pilares do colonialismo no século XIX – desqualificando as fontes do saber africano conhecidas desde a Antiguidade –, negou a possibilidade de os africanos produzirem filosofia. Então, o reconhecimento como filósofos, no sentido estrito do termo, de pensadores nascidos na África e de uma linha filosófica deles originada só ocorreu a partir do século XX.

Filosofias africanas trata tanto dos saberes ancestrais africanos, sua essência preservada nos provérbios, na diversidade multicultural e nos ensinamentos passados durante gerações por meio da oralidade, quanto da contribuição de filósofos africanos e afrodescendentes contemporâneos na atualização desses saberes, muitos dos quais pautados no decolonialismo. Nei Lopes e Luiz Antonio Simas, de maneira didática, mais uma vez escreveram uma obra que evidencia a complexidade, sofisticação e profundidade do pensamento africano e das perspectivas de mundo que sua filosofia provoca.
Brasil: uma história;1808;O propósito deste livro, resultado de dez anos de investigação jornalística, é resgatar e contar a história da corte lusitana no Brasil e tentar devolver seus protagonistas à dimensão mais correta possível dos papéis que desempenharam duzentos anos atrás. '1808 - Como uma rainha louca, um príncipe medroso e uma corte corrupta enganaram Napoleão e mudaram a História de Portugal e do Brasil' é o relato sobre um dos principais momentos históricos brasileiros.

História / História do Brasil / História Geral
Box O Essencial da Estratégia;Box O Essencial da Estratégia;O Box Especial "O Essencial da Estratégia", contém três livros: A Arte da Guerra, de Sun Tzu, O Príncipe de Nicolau Maquiavel e O Livro dos Cinco Anéis de Miyamoto Musashi reunidas no luxuoso kit. São três títulos essenciais que se complementam além de serem leituras obrigatórias para qualquer pessoa que queira sair do lugar comum e se destacar na vida.

Administração
História Concisa do Brasil;História Concisa do Brasil;Este livro destina-se a um público amplo, partindo de dois pressupostos básicos: de um lado, a convicção de que é possível levar ao conhecimento geral uma história escrita em linguagem acessível, sem perda de qualidade de outro, a afirmação de que tratar de conhecer e interpretar o passado é uma condição indispensável para que os cidadãos - especialmente os jovens - possam se situar no presente e avaliar as possibilidades e limites do futuro do país. A obra não é um simples resumo da História do Brasil, Mantém a estrutura básica anterior, cujo objetivo é tornar compreensível as linhas principais da história brasileira, mas cumpre a tarefa de forma sintética, atualizando, ao mesmo tempo, os dados estatísticos e o capítulo de conclusão.
A Segunda Guerra Mundial: Os 2.174 dias que mudaram o mundo;A Segunda Guerra Mundial;A Segunda Guerra Mundial foi o conflito global mais destrutivo da história. Quarenta milhões de pessoas morreram durante os 2.174 dias desde o ataque da Alemanha contra a Polônia, em setembro de 1939, até a rendição do Japão, em agosto de 1945.
Nestas páginas, Martin Gilbert narra cada dia, semana, mês e ano de avanço do terrível rolo compressor de morte e destruição que se alastrou por vários países. Com as palavras de representantes do nazismo, como Hitler, Goebbels e Himmler, da oposição e dos aliados, como Stálin, Churchill e Roosevelt, e até de vítimas anônimas das atrocidades, estas páginas perfazem a história completa em suas múltiplas perspectivas. Entrelaçando todos os aspectos da guerra global - político, diplomático, militar e civil -, e ainda com os mapas transitórios de países que se segregaram e unificaram ao longo dos anos de conflito e fotos marcantes dos acontecimentos, o autor traça um panorama único e definitivo sobre a guerra mais estudada da história e que até hoje traz revelações surpreendentes.

Este livro narra, como um diário meticuloso, o dia a dia do maior conflito global do século XX. Unindo o drama das vítimas ao desenvolvimento militar do confronto, Martin Gilbert ilumina de um ponto de vista inédito a cronologia da Segunda Guerra Mundial, tecendo sua mais completa e íntima história.
O Caibalion: Um estudo da filosofia hermética do Antigo Egito e da Grécia;O Caibalion: Um Estudo Da Filosofia Hermética Do Antigo Egito e da Grécia;Se você já ouviu falar do conceito conhecido como a "LEI DA ATRAÇÃO", então você acessou apenas uma fração do potencial da sabedoria antiga encontrada em O CAIBALION. Este misterioso livro é uma iniciação à grande sabedoria expressa pelo hermetismo, uma tradição mística que atravessou o tempo desde a Antiguidade até o presente, distante da percepção da maioria das pessoas. Hermes Trismegisto, também conhecido como O TRÊS VEZES GRANDE, é considerado, entre outros, o pai do ocultismo, da astrologia e da alquimia aquele que transmitiu o conhecimento divino à humanidade e que inspirou, por séculos, escritores e estudiosos da literatura ocultista. A melhor introdução ao hermetismo, tanto para principiantes como para Adeptos, este clássico explora princípios relevantes para todas as tradições religiosas, místicas e espirituais. Uma interpretação atual da doutrina hermética, que mostra como os sete princípios podem ser aplicados ao autodesenvolvimento na vida diária.
Os Onze: O STF, seus bastidores e suas crises;Os Onze;Desde o julgamento da ação penal 470, mais conhecida como Mensalão, o Supremo Tribunal Federal viu-se no centro do debate nacional. Seus integrantes se tornaram amplamente conhecidos e, também por isso, passaram a usar a opinião pública como fundamento para seus votos. Nos turbulentos anos de uma das maiores crises políticas e econômicas que o país já viveu, o protagonismo a que foi alçado o tribunal criou um conjunto novo de desafios.

O jornalista Felipe Recondo, especialista na cobertura do STF, acompanha e analisa o cotidiano do Supremo há mais de uma década. Luiz Weber estuda o funcionamento do tribunal e analisa os movimentos e forças políticas que interagem com o STF. Ao longo de anos, os dois realizaram centenas de entrevistas para escrever Onze: O STF, seus bastidores e suas crises. O livro traz histórias que permitem descrever os contornos, causas e consequências dos grandes casos que envolveram o tribunal, incluindo o recente e polêmico inquérito sobre fake news aberto por Dias Toffoli e comandado por Alexandre de Moraes.

Onze é o número de ministros do Supremo, que atuam como “onze ilhas”. A expressão foi cunhada pelo ex-ministro do STF Sepúlveda Pertence e se consolidou como chave de interpretação para o funcionamento do tribunal, com a proliferação de decisões monocráticas e a sucessão de embates internos. Num momento em que o STF se vê sob o ataque de expoentes do governo federal e de militantes nas redes sociais, entender as dinâmicas da última instância do poder judiciário é mais importante do que nunca.
SPQR: Uma história da Roma antiga;SPQR;Cobrindo mil anos da história romana, SPQR revela em detalhes como Roma cresceu de uma vila insignificante na Itália Central para se tornar a primeira potência global. A inglesa Mary Beard, professora de Cambridge e autora de vários best-sellers, vive há mais de 30 anos pesquisando o Império Romano. A partir de inúmeras leituras, estudos de arqueologia e de documentos escritos em pedras e papiros, ela faz uma análise eloquente dessa história e mostra o que os romanos pensavam sobre si mesmos e suas realizações. SPQR é a abreviação que os próprios romanos adotaram para o seu Estado: “Senatus Populus Que Romanus”, ou “Senado e o Povo de Roma”. Neste livro, Beard detalha como foi formada a identidade e a cidadania romana e mostra porque essa cultura ainda influencia o mundo no século XXI. Com mais de 100 ilustrações e inúmeros mapas, SPQR ficou mais de um ano em listas de best-sellers nos Estados Unidos e na Europa. “Mary Beard explica o que foi o império romano de maneira clara e precisa, com paixão e sem jargões técnicos. SPQR é uma história cruel, mas contada de uma forma maravilhosamente instigante”. WALL STREET JOURNAL “Magistral. Um caso exemplar de história popularizada, de leitura envolvente, mas sem simpli cação excessiva, que oferece uma visão abrangente e também detalhes íntimos que dão vida ao passado distante”. ECONOMIST “Beard revela os segredos do sucesso da cidade de Roma com uma clareza resoluta e impiedosa que eu não vi igualada em nenhum outro lugar”. e New York Times “Se contassem com Mary Beard a seu lado naquela época, os romanos ainda teriam seu império”. DAILY MAIL
Armas, germes e aço;Armas, Germes e Aço;O homem é fruto do meio? Para o vencedor do Prêmio Pulitzer, o fisiologista americano Jared Diamond, é óbvio que fatores ambientais e geográficos moldaram o mundo moderno. Em ARMAS, GERMES E AÇO, Jared reúne um cruzamento de descobertas conjugando arqueologia e epidemiologia com história e geografia. Com isso esclarece como e porque as sociedades humanas dos diferentes continentes seguiram caminhos de desenvolvimento diversos nos últimos 13 mil anos e explora as razões da dominação e submissão. ARMAS, GERMES E AÇO - considerado pela crítica especializada como o mais importante livro de não-ficção dos últimos três anos - derruba teorias racistas e mostra que a superioridade da Europa e da Ásia se deve às suas respectivas geografias, mais propícias ao cultivo da terra, à domesticação de animais e ao trânsito de informações. O livro mostra, ainda, como a história e a biologia podem dar suporte uma à outra para produzir um profundo entendimento da condição humana. Um sumário da trajetória dos homens comparável à obra deixada por Darwin. Diamond consegue emprestar um toque arejado às conclusões e transformou ARMAS, GERMES E AÇO num sucesso de crítica e público, apresentando teorias ainda inéditas para as desigualdades sociais encontradas em nosso mundo. Jared consegue convencer o leitor de que sociedades que tiveram um começo mais adiantado na produção de comida - a ponto de conseguir estocá-la -, logo desenvolveram ritos religiosos e se aventuraram na conquista de novos territórios, tornando-se regiões mais ricas e, posteriormente, nações mais desenvolvidas. ARMAS, GERMES E AÇO recebeu vários prêmios...
Mulheres e deusas: Como as divindades e os mitos femininos formaram a mulher atual;Mulheres e Deusas;Obá, Afrodite, Eva, Naiá. Mulheres, deusas, mitos. Neste livro, o filósofo Renato Noguera apresenta aos leitores as histórias de divindades e personagens femininas nas culturas grega, iorubá, judaico-cristã e guarani, fazendo uma reflexão sobre o lugar das mulheres em diferentes sociedades, e como a mitologia ajuda a entender e manter os papeis de gênero.

História
Fascismo à brasileira: Como o integralismo, maior movimento de extrema-direita da história do país, se formou e o que ele ilumina sobre o bolsonarismo;Fascismo à brasileira;Se é inegável que entende melhor o presente quem conhece o passado, é fundamental conhecer o integralismo para compreender a essência do bolsonarismo. Sim, o Brasil teve um movimento fascista e anticomunista na sua história na mesma época de Mussolini e Hitler. Fundado pelo deputado e jornalista Plínio Salgado, a Ação Integralista Brasileira foi o maior movimento fascista fora da Europa entre os anos 1920 e 1940 – e também o maior movimento de extrema-direita no país até o surgimento de Jair Bolsonaro. Era uma organização nacionalista, autoritária e tradicionalista. Chegou a ter um milhão de adeptos que eram conhecidos como os “encamisados” ou “camisas- verdes” por se vestirem de verde – como se vestiam de preto os discípulos de il duce na Itália e de cáqui a legião de seguidores do führer na Alemanha.
Inspirado pelos líderes europeus, Plínio era anticomunista e defendia as ideias do fascismo, entre elas a defesa de uma identidade nacional e a crença de que a salvação da pátria exigia tanto a obediência a um “salvador da pátria” como a destruição dos inimigos internos. Como instrumentos, pregava a violência e o militarismo ao mesmo tempo em que tinha como valores fundamentais a família e a religião.
Apesar de ter durado poucos anos, a Ação Integralista Brasileira contou com expoentes como o jurista Miguel Reale, o antropologista Câmara Cascudo, o arcebispo Dom Hélder Câmara, o escritor José Lins do Rego e o músico Vinícius de Moraes.
Em Fascismo à brasileira, Pedro Doria conta esse momento pouco estudado da história brasileira com uma riqueza de
detalhes que permitirá ao leitor não só conhecer o integralismo como fazer, ele próprio, as conexões entre passado e presente
Box Coleção Brasilis: 4 Livros – A Viagem Do Descobrimento; Náufragos, Traficantes E Degredados; Capitães Do Brasil E A Coroa, A Cruz E A Espada;Box Coleção Brasilis: 4 Livros;"Ao escrever com foco global e grande riqueza narrativa, Eduardo Bueno permite que o leitor se delicie com a dialética entre o particular e o geral, o local e o mundial – afinal a característica nova para os encontros humanos que essa viagem do descobrimento efetivamente permitiu. Uma leitura imperdível."– Jorge Caldeira, autor de Mauá, empresário do Império

"Ele conta história do jeito que deveria ser nas escolas: sem aquele monte de datas para decorar."– Drauzio Varella, médico e escritor

"Tornei-me um pouco menos ignorante em relação à história do Brasil graças aos livros de Bueno. Viajei bastante com ele."– Walter Salles Jr., cineasta

"Uma das artes mais difíceis é a de escrever bem, de modo claro e sintético, mantendo-se fiel aos acontecimentos. Pois é isso que Eduardo Bueno consegue em uma síntese de séculos de nossa história. Não há melhor introdução para um público não especializado que queira ter uma noção da história do Brasil."– Fernando Henrique Cardoso, sociólogo, ex-presidente do Brasil

"O Brasil estava precisando de livros de história gostosos de ler. Achei fascinante." – Fernanda Torres, atriz

"Eduardo Bueno é o Capistrano de Abreu do nosso tempo. A diferença é que seus livros são lidos por centenas de milhares de leitores."– Max -Justo Guedes, contra-almirante e historiador

"Eduardo Bueno descobriu o Brasil e não foi comido pelos índios."– Fernando Gabeira, escritor

"Ao ler, me senti cumprindo uma obrigação – de saber das minhas raízes – com o maior prazer."–Marília Gabriela, jornalista e atriz

"De um historiador para outro." – Do autógrafo dado por Eric Hobsbawm a Eduardo Bueno
Doze Anos de Escravidão;Doze Anos de Escravidão;Considerada a melhor narrativa já escrita sobre um dos períodos mais nebulosos da história americana, Doze anos de escravidão narra a história real de Solomon Northup, um negro livre que, atraído por uma proposta de emprego, abandona a segurança do Norte e acaba sendo sequestrado e vendido como escravo.
Depois de liberto, Northup publicou o relato contundente de sua história, que se tornou um best-seller imediato. Hoje, 160 anos após a primeira edição, Doze anos de escravidão é reconhecido como uma narrativa de qualidades excepcionais. Para a crítica, o caráter especial do livro deve-se ao fato de o autor ter sido um homem culto que viveu duas vidas opostas, primeiro como cidadão livre e depois como escravo.

“O livro nos encantou: a dimensão épica, o detalhamento, a aventura, o horror, a humanidade. Lia-se como um roteiro de cinema, pronto para ser filmado. Eu não podia acreditar que nunca ouvira falar nele. Pareceu-me tão importante quanto O diário de Anne Frank, só que publicado quase cem anos antes.” - Steve McQueen, diretor do filme 12 anos de escravidão
As vidas de José Bonifácio;As vidas de José Bonifácio;Conhecido como o Patrono da Independência do Brasil, José Bonifácio é uma figura histórica tão fascinante quanto enigmática. Sua aura de mistério intrigou inúmeros pesquisadores, que buscaram encontrar em sua trajetória qualidades e feitos que comprovassem seu heroísmo, sua genialidade, seu patriotismo.

Ao procurar entender quem foi o homem por trás do mito, no entanto, a historiadora Mary Del Priore descobriu não o super-homem que seus pares procuraram, mas um personagem de seu tempo, cheio de contradições e dilemas, forjado – como qualquer um de nós – pelas circunstâncias da vida.

Se algo conduziu fortemente o destino de Bonifácio, foram sua ambição e sua curiosidade, que o levaram a viajar incansavelmente entre Velho e Novo Mundo. Em suas andanças, ele conviveu com noções de liberdade e escravidão, explorou o meio ambiente, conheceu povos indígenas. Desejou conquistar o mundo e alcançou mais do que as circunstâncias podiam lhe oferecer.

Com uma narrativa envolvente que se assemelha à de um romance, repleta de citações históricas e casos pitorescos, As vidas de José Bonifácio deixa claro por que Mary Del Priore ocupa um lugar de destaque na divulgação da História do Brasil ao grande público.
A República;A República (Coleção A Obra Prima de Cada Autor);Autor de vasta obra filosófica, Platão preocupou-se com o conhecimento das verdades essenciais que determinam a realidade e, a partir disso, estabeleceu os princípios éticos que devem nortear o mundo social.

A República é uma das obras-primas de Platão. Nela o filósofo expõe suas idéias políticas, filosóficas, estéticas e jurídicas. Aqui se encontra a "Alegoria da Caverna", uma das mais belas passagens de toda a obra de Platão. O filósofo imaginou um Estado ideal, sustentado no conceito de justiça.
Orientalismo: O Oriente como invenção do Ocidente;Orientalismo;Neste livro de 1978, Edward W. Said mostra que o Oriente não é um nome geográfico entre outros, mas uma invenção cultural e política do Ocidente que reúne as várias civilizações a leste da Europa sob o mesmo signo do exotismo e da inferioridade. Recorrendo a fontes e textos diversos - descrições de viagens, tratados filológicos, poemas e peças, teses e gramáticas -, Said mostra os vínculos estreitos que uniram a construção dos impérios e a acumulação de um fantástico e problemático acervo de saberes e certezas européias. A investigação da origem e dos caminhos do Orientalismo como disciplina acadêmica, gosto literário e mentalidade dominadora, vai e volta do século XVIII aos dias de hoje, das traduções das Mil e uma noites à construção do canal de Suez, das viagens de Flaubert e Lawrence da Arábia às aventuras guerreiras de Napoleão no Egito ou dos Estados Unidos no golfo Pérsico.
Os jacobinos negros: Toussaint L'Ouverture e a revolução de São Domingos;Os Jacobinos Negros;As tropas brasileiras ocupam as favelas de Porto Príncipe, capital do Haiti, na maior ação militar do país no exterior em décadas. Mas que país é o Haiti, hoje o mais pobre da região, mas que foi a primeira nação da América Latina a se tornar independente? Qual é a sua história?

Em 1938, no auge do nazismo e da predominância das teorias de supremacia da raça branca em todo o mundo, o escritor C. L. R. James demolia preconceitos ao mostrar a função histórica da escravidão e a função social da opressão do negro.

Os jacobinos negros é um verdadeiro tratado sobre essa questão e projeta luz sobre o pano de fundo histórico do drama atual do Haiti. O autor faz um relato minucioso da insurreição de escravos que expulsou os colonizadores franceses de São Domingos, antigo nome do país. Na colônia, principal parceiro comercial da França, integrada a economia mundial da época, a população negra que gerava a riqueza era dez vezes maior do que a dos brancos. Ali, os ideais da revolução na metrópole, que pregava "liberdade, igualdade e fraternidade" ecoaram nas lideranças dos escravos rebelados, os jacobinos negros. Com o ideal de construir um país independente que se aliaria a França revolucionária em pé de igualdade, um "posto avançado" dos ideais revolucionários no continente americano.

A independência foi conquistada não com o apoio, mas em combates contra as tropas francesas, inglesas e espanholas. Mas isolados da economia internacional, por terem se rebelado contra a escravidão em uma época onde os Estados Unidos, Cuba e Brasil eram sociedades escravocratas, a rebelde ilha caribenha foi "condenada" ao atraso por sua ousadia. O destino de seu líder, Toussaint L`Ouverture, foi trágico.

