Eram os deuses astronautas?;Eram os Deuses Astronautas?;Em 'Eram os deuses astronautas?', o autor, que dedicou a vida a pesquisas pelo mundo todo, defende a existência de outros seres inteligentes no universo e propõe que extraterrestres tenham trazido grandes conhecimentos à Terra. A evidência disso estaria nos achados arqueológicos, monumentos antigos, mapas e outras marcas.

Literatura Estrangeira / Ufologia
História da riqueza no Brasil;História da Riqueza no Brasil;"História da riqueza no Brasil é ao mesmo tempo tão monumental quanto síntese. Há algumas definitivas, como as do trio Gilberto Freyre-Sérgio Buarque de Holanda-Caio Prado. A diferença? São mais de quinhentos anos relidos e explicados em nova chave. Pois para realizar a sua, Caldeira serviu-se de disciplinas vizinhas, a antropologia e a econometria, enriquecendo interpretações que já vinha consolidando em obras anteriores.
A antropologia lhe permitiu se aproximar do passado, iluminando objetos como a família, a mestiçagem, atitudes econômicas, as alianças de poder, revelando sua surpreendente permanência ao longo de cinco séculos. Quanto a econometria, essa forneceu medidas e estatísticas mal e pouco conhecidas de grande parte dos historiadores, para apreender fatos que só mediante esta abordagem são capturáveis." - Mary del Priore
"(Caldeira) ressalta, o que para poucos era claro, que o mercado interno sempre teve importância maior do que lhe foi atribuída por muitos autores, mesmo de livros clássicos. Não que se deixe de reconhecer o papel importantíssimo do mercado externo para a inserção mundial da economia, mas desaparece o retrato simplificador da sociedade brasileira do passado como se ela fosse formada apenas pela grande lavoura de exportação.
Em segundo lugar, trata-se de obra que traz uma abordagem metodológica rara: Caldeira introduz a referência a números, aos grandes números, na narrativa histórica e os usa para a comprovação de suas teses. Como se isso não bastasse para dar singularidade e notoriedade ao livro, acrescente-se que suas páginas mostram o fracasso das tentativas de acelerar o crescimento econômico pela vontade política do Estado." - Fernando Henrique Cardoso
A formação das almas;A Formação das Almas;O que dizem sobre a história de um país os monumentos erguidos em praça pública? Ou as bandeiras e hinos nacionais? Ou, ainda, caricaturas e charges tiradas das páginas de um jornal? José Murilo de Carvalho mostra, com a sensibilidade característica dos bons pesquisadores, como esse material pode ser de grande utilidade para se decifrar a mitologia e a simbologia de um sistema político.
Por meio de imagens, o autor nos oferece um curioso passeio pelo momento de implantação do regime republicano. Entre texto e ilustrações, aprendemos como os mitos de origem criados para a República, seus heróis, a bandeira verde-amarela e o nosso hino traduzem com fidelidade as batalhas travadas pela construção de um rosto para a República brasileira.

Por meio de imagens, o autor nos oferece um curioso passeio pelo momento de implantação do regime republicano. Entre texto e ilustrações, aprendemos como os mitos de origem criados para a República, seus heróis, a bandeira verde-amarela e o nosso hino traduzem com fidelidade as batalhas travadas pela construção de um rosto para a República brasileira
Como funciona o fascismo: A política do “nós” e “eles”;Como funciona o Fascismo;Fascismo: originalmente, regime de cunho ideológico estabelecido pelo ditador Benito Mussolini na Itália da década de 1920, que valoriza ideais de nação e raça em detrimento dos valores individuais e é representado por um líder autoritário. Mas por que esse termo voltou à ordem do dia em pleno século XXI?

À luz de episódios recentes de democracias que enveredaram para regimes mais ou menos totalitários de líderes democraticamente eleitos que usam retóricas fascistas para fazer política, como Donald Trump mas também bebendo no extenso histórico do fascismo – de Mein Kampf, de Hitler, aos discursos fratricidas que levaram ao genocídio de Ruanda na década de 1990 –, ­Jason Stanley analisa a estrutura comum por trás de todas essas experiências. Ele estabelece os dez principais fundamentos do fascismo, entre os quais encontramos: a ideia de reviver um passado mítico e glorioso o uso de propaganda para distorcer e minar conceitos e instituições democráticas (tendo como pretexto o combate à corrupção) ataques a universidades e intelectuais uma forte ­noção de hierarquia a política da lei e da ordem baseada na ideia de grupos minoritários criminosos e a valorização do “trabalho duro” em prejuízo de sistemas de bem-estar social.

Tais mecanismos apoiam-se uns aos outros simbioticamente, criando e reforçando divisões, ao mesmo tempo em que minam os pilares da democracia – eleições livres, judiciário independente, liberdade de expressão e de imprensa etc. – que poderiam conter a ascensão totalitária. A história nos mostra o imenso perigo de subestimar o poder cumulativo dessas táticas, que deixam a sociedade cada vez mais vulnerável aos apelos da liderança autoritária. Apenas identificando as políticas fascistas, o autor argumenta, poderemos resistir a seus efeitos mais danosos e retornar aos ideais democráticos.
O trato dos viventes: Formação do Brasil no Atlântico Sul;O Trato dos Viventes;Luiz Felipe de Alencastro demonstra um paradoxo histórico - o de que o Brasil se formou fora do Brasil, o de que a nossa história colonial não se confunde com a continuidade do nosso território colonial. A idéia exposta neste livro é nova e relativamente simples - a colonização portuguesa, baseada no escravismo, deu lugar a um espaço econômico e social bipolar, englobando uma zona de produção escravista situada no litoral da América do Sul e uma zona de reprodução de escravos centrada em Angola. Desde o final do século XVI, surge um espaço aterritorial, composto dos enclaves da América portuguesa e das feitorias de Angola. É daí que emerge o Brasil do século XVIII. O autor mostra como essas duas partes unidas pelo oceano se completam num só sistema de exploração colonial cuja singularidade ainda marca profundamente o Brasil contemporâneo.





Opinião do Leitor:



Ricardo Meier / Data: 7/5/2008

Conceito do leitor:

uma nova perspectiva histórica

O livro já e quase um clássico, do quanto de qualidade tem a nossa pesquisa histórica, trazendo novas perspectivas de entendimento sobre temas como a escravidão e nossas raízes.





Jader de Souza Barcellos / Data: 20/5/2003

Conceito do leitor:

Três séculos no Atlântico Sul

Livro interessantíssimo. Muitos estudantes colocam que a grande dificuldade de entendimento da história brasileira está no fato de não compreenderem o processo escravista. Este livro vem auxiliar esse entendimento, ao mostrar a maneira como os escravos chegavam ao Brasil. O autor ao mencionar o Atlântico Sul, explicita muito bem o caminho escravista, vindo da África e chegando ao Brasil. Um grande acréscimo de conhecimento é possível se for lido o livro: Formação Econômica do Brasil, de Celso Furtado.
A era do capital: 1848;A Era do Capital - 1848 - 1875;No apagar das chamas revolucionárias (1848), surgiu uma época de relativa paz , um período em que se desenvolveram um novo estilo e uma nova escala de valores que, juntos, formaram A era do capital. Análise detalhada da ascensão do capitalismo industrial e da consolidação da cultura burguesa.

História / História Geral
Histórias da gente brasileira;Histórias da Gente Brasileira (Império #2);Quantos heróis, líderes e grandes figuras fazem a história de um país? Cem, duzentos, ou até menos. Contada de forma tradicional, ela privilegia um seleto grupo de personagens ilustres. Mas não são eles que definem a nação da forma como a conhecemos. A história de um país é traçada por milhares de anônimos, homens e mulheres que constroem caminhos e jeitos de viver e se relacionar. A história do Brasil é escrita no dia a dia, pela totalidade das suas gentes. Após o sucesso do primeiro volume da coleção, chega às lojas Histórias da gente brasileira vol. 2 – Império, de Mary Del Priore. Neste livro, a escritora e historiadora premiada aborda um dos momentos mais interessantes de nossa trajetória, a partir de um ângulo que vai além do convencional ao focar nos detalhes da vida cotidiana. Hábitos, costumes, modos de vestir, de falar, moradias, divertimentos, o papel da mulher... Nada passa despercebido pelo olhar sensível e acurado de Priore. Ricamente ilustrado, o livro traz ainda reflexões sobre a formação das grandes cidades - ajudando a explicar as diferenças regionais que até hoje marcam o país, além de questionar o mito do “homem cordial” ao contar com minúcias como se deram as diversas revoltas que explodiram neste período. Portanto, que tal olhar pelo buraco da fechadura e descobrir o que há por trás das cortinas do Brasil Império? Este é o segundo volume da coleção “Histórias da gente brasileira”, que contará ainda com outros dois livros sobre a República.
Da Alma;Alma? (O Protetorado da Sombrinha #1);Alexia Tarabotti enfrenta uma série de atribulações sociais, quiproquós e saias justas (embora compridíssimas) em plena sociedade vitoriana. Em primeiro lugar, ela não tem alma. Em segundo, é solteirona e filha de italiano. Em terceiro, acaba sendo atacada sem a menor educação por um vampiro, o que foge a todas as regras de etiqueta.
E agora? Pelo visto, tudo vai de mal a pior, pois a srta. Tarabotti mata sem querer o vampiro ― ocasião em que a Rainha Vitória envia o assustador Lorde Maccon (temperamental, bagunceiro, lindo de morrer e lobisomem) para investigar o ocorrido.
Com vampiros inesperados aparecendo e os esperados desaparecendo, todos parecem achar que a srta. Tarabotti é a responsável. Será que ela conseguirá descobrir o que realmente está acontecendo na alta sociedade londrina? Será que seu dom de sem alma para anular poderes sobrenaturais acabará se revelando útil ou apenas constrangedor? No fim das contas, quem é o verdadeiro inimigo, e... será que vai ter torta de melado?
Uma das séries de Steampunk mais cultuada do mundo.
1001 invenções que mudaram o mundo;1001 Invenções que mudaram O Mundo;Em "1001 Invenções que Mudaram o Mundo", você vai descobrir detalhes curiosos sobre algumas das mais importantes invenções de todos os tempos, desde aquelas que ajudaram o homem a evoluir até as que simplesmente tornaram a vida mais prática.

Da roda ao MP3, das ferramentas de pedra ao avião, este livro explora a história por trás de cada invento e traça o caminho desde sua concepção até os mais recentes aprimoramentos.

Escrito por uma equipe de historiadores, cientistas, designers e antropólogos, este guia vai agradar tanto às pessoas que desejam aprender sobre o desenvolvimento da ciência e da tecnologia quanto aos curiosos que adoram saber detalhes divertidos sobre o mundo que os cerca.
Forças Armadas e política no Brasil;Forças Armadas e Política no Brasil;Depois do choque que foi o golpe militar de 1964, restou a incômoda pergunta - como ninguém foi capaz de prevê-lo e de resistir a ele, mesmo tendo se discutido tanto a respeito? É para investigar essa e outras questões - como a relação entre civis e militares, a história dos pracinhas da FEB, as características do Exército brasileiro e do próprio imaginário militar - que José Murilo de Carvalho, um dos principais pesquisadores sobre as Forças Armadas no Brasil, reúne diversos textos seus, publicados ao longo de trinta anos.
Declínio e queda do império romano;Declínio e queda do Império Romano;Publicado em seis volumes, entre 1776 e 1778, este estudo sobre o Império Romano foi, desde então, um marco na produção clássica e historiográfica mundial. Hoje, além de importante documento histórico, é uma das principais contribuições para a interpretação da história de Roma, e a obra mais famosa da historiografia inglesa. Da época de Trajano e dos Antoninos à tomada de Constantinopla, 1300 anos são narrados por Gibbon, um dos maiores estilistas da literatura inglesa. Irônico e contundente, o historiador apresenta o que considerou o "triunfo da barbárie e da religião" sobre as nobres virtudes romanas. E relata mais um capítulo da história, a qual define como "pouco mais do que o registro dos crimes, loucuras e desventuras da humanidade".
Civilização;Orgulho e Preconceito;Na Inglaterra do final do século XVIII, as possibilidades de ascensão social eram limitadas para uma mulher sem dote. Elizabeth Bennet, de vinte anos, uma das cinco filhas de um espirituoso, mas imprudente senhor, no entanto, é um novo tipo de heroína, que não precisará de estereótipos femininos para conquistar o nobre Fitzwilliam Darcy e defender suas posições com perfeita lucidez de uma filósofa liberal da província. Lizzy é uma espécie de Cinderela esclarecida, iluminista, protofeminista. Neste livro, Jane Austen faz também uma crítica à futilidade das mulheres na voz dessa admirável heroína — recompensada, ao final, com uma felicidade que não lhe parecia possível na classe em que nasceu.
Cultura geral: Tudo o que se deve saber;Cultura Geral;Muitas vezes o conhecimento viu-se restringido por fórmulas e barreiras, distanciando-se de sua função mais útil, que é a de enriquecer nossas vidas e nos conhecer melhor. Como e por que surgiram a sociedade moderna, o Estado, a ciência, a democracia ou a administração? O que disse Heidegger que já não soubéssemos? Por que Dom Quixote, Hamlet, Fausto, Robinson, Falstaff ou Dr. Jekyll e Mrs. Hide são figuras tão conhecidas?

Onde estava o inconsciente antes de Freud? Este livro aborda os episódios remotos centrais do Velho e do Novo Testamento a emergência dos Estados e a epopeia da modernização, as revoluções e a democracia a evolução da literatura, da arte e da música através de suas grandes obras o desenvolvimento da ciência e da filosofia, o campo da batalha das ideologias, das cosmogonias e das teorias.

Aborda também a educação dada pelos livros, colégios e universidades, pelos jornais e foros de opiniões. Um quadro cronológico, uma breve relação dos livros que transformaram o mundo e conselhos de leitura aumentam a utilidade desta obra imprescindível.
Memórias do Calabouço;Memórias do Calabouço;Prêmio Bartolomé Hidalgo na categoria Testemunhos.

Pepe Mujica, Mauricio Rosencof e Eleutério Fernández Huidobro não eram prisioneiros: eles eram reféns da ditadura cívico militar que tomou o poder no Uruguai em 1973. Se as famílias fizessem denúncias no exterior, se os companheiros Tupamaros atentassem contra os militares, se um resgate fosse tentado, os três reféns seriam executados.

A comida era pouca, às vezes nenhuma. O frio intenso. Quando queriam ir ao banheiro, eram amarrados, encapuzados, e habitualmente espancados no trajeto. De tão precárias as condições, apegaram-se ao capuz, o mesmo que os vendava, e o utilizavam de travesseiro, de coberta, mantinham-no limpo, da forma como era possível em condições tão insalubres.

Comunicar-se era definitivamente proibido. Ainda assim, batendo os dedos contra a parede, num código morse improvisado, conversavam, lutavam, militavam, jogavam xadrez.

Finalmente libertados, em 1985, Mauricio Rosencof, o Russo, e Eleutério Fernández Huidobro, o Nhato, colocam-se diante de um gravador para narrar todo o vivido naqueles 12 anos. Pepe Mujica, futuro presidente do Uruguai, editou o livro. Eduardo Galeano escreveu o prefácio. Assim publica-se a primeira edição de “Memórias do Calabouço”, livro fundamental para se compreender as ditaduras sul-americanas.
O Fascismo em Camisas Verdes. Do Integralismo ao Neointegralismo;O Fascismo em Camisas Verdes;Este livro traça a história do fascismo no Brasil desde sua origem, com Plínio Salgado, Gustavo Barroso e Miguel Reale, até às ações mais recentes, como o ataque à produtora Porta dos Fundos, ocorrido no Natal de 2019. Os autores elucidam como foi a trajetória do integralismo, cujo principal líder foi Plínio Salgado, e descrevem o início deste movimento sob influência do fascismo original, após encontro do então futuro líder dos camisas-verdes, como era conhecido o movimento integralista no Brasil, com Benito Mussolini, líder dos fascistas italianos, conhecidos como os camisas-negras. A história também atravessa todo o período do neointergalismo, com especial atenção aos movimentos que iniciaram em 2004 e chega ao evento do Natal de 2019, considerado pelos autores como a mola propulsora para a elaboração deste livro, uma vez que nas buscas policiais aos responsáveis pelo ataque à sede da produtora, a polícia apreendeu simulacros de armas, facas e mais de 100 mil reais, além de livros relacionados com o universo da extrema direita: de Plínio Salgado a Olavo de Carvalho, cujo nome circula com frequência nas redes sociais e conversas do cotidiano. Trata-se uma obra voltada a um público amplo, com uma escrita fluida e que certamente ajudará a compreender o atual momento em que o Brasil se encontra.
1889;1889;Nas últimas semanas de 1889, a tripulação de um navio de guerra brasileiro ancorado no porto de Colombo, capital de Ceilão (atual Siri Lanka), foi pega de surpresa pelas notícias alarmantes que chegavam do outro lado do mundo. O Brasil havia se tornado uma república.

O império brasileiro, até então tido como a mais sólida, estável e duradoura experiência de governo na América Latina, com 67 anos de história, desabara na manhã de quinze de novembro. O austero e admirado imperador Pedro II, um dos homens mais cultos da época, que ocupara o trono por quase meio século, fora obrigado a sair do país junto com toda a família imperial. Vivia agora exilado na Europa, banido para sempre do solo em que nascera.

Enquanto isso, os destinos do novo regime estavam nas mãos de um marechal já idoso e bastante doente, o alagoano Manoel Deodoro da Fonseca, considerado até então um monarquista convicto e amigo do imperador deposto. Essas e outras histórias surpreendentes estão 1889, o novo livro do premiado escritor Laurentino Gomes. A obra, que trata da Proclamação da República, fecha uma trilogia iniciada com 1808, sobre a fuga da corte portuguesa de Dom João para Rio de Janeiro, e continuada com 1822, sobre a Independência do Brasil.

Somados, os dois livros venderam mais de 1,5 milhão de exemplares no Brasil e ganharam quatro prêmios Jabuti, o mais prestigiado da literatura brasileira. Com 24 capítulos e ricamente ilustrado, 1889 contribui para a compreensão de um dos períodos mais controversos da história do país, em um relato cativante que explica não só os acontecimentos que levaram à queda da monarquia, em 1889, mas também outros episódios importantes da história brasileira como a Guerra do Paraguai e o movimento abolicionista.
Utopias Latino-americanas: política, sociedade, cultura;Utopias Latino-americanas;Como as utopias contam a História da América Latina? Com essa questão em vista, a historiadora Maria Ligia Prado, um dos grandes nomes da área no Brasil, conseguiu a façanha de reunir importantes especialistas de todo o continente neste livro instigante. Dividida em 5 seções – Utopias étnico-raciais e de gênero Utopias do conhecimento Utopias, representações e imaginários Utopias políticas Utopias da integração e da identidade latino-americana –, a obra ousa ao examinar a historicidade da utopia, com vistas a iluminar a distopia do presente.
História Geral e do Brasil;1808;O propósito deste livro, resultado de dez anos de investigação jornalística, é resgatar e contar a história da corte lusitana no Brasil e tentar devolver seus protagonistas à dimensão mais correta possível dos papéis que desempenharam duzentos anos atrás. '1808 - Como uma rainha louca, um príncipe medroso e uma corte corrupta enganaram Napoleão e mudaram a História de Portugal e do Brasil' é o relato sobre um dos principais momentos históricos brasileiros.

História / História do Brasil / História Geral
A mais breve história da Europa;A Mais Breve História da Europa;Mais de 450 mil exemplares vendidos no mundo.

Sintético porém abrangente, A mais breve história da Europa encara o desafio de resumir milênios em poucas páginas, mas não se limita a descrever os acontecimentos e todos os fatos importantes – ele explica o que cada um deles significou para a Europa e como influenciou e influencia o resto do mundo.


Neste livro ágil e provocador, o renomado historiador John Hirst explica o que tornou a Europa o berço da civilização ocidental e a sociedade mais vanguardista do planeta em áreas como arte, ciência, filosofia e qualidade de vida.

Hirst começa identificando as três forças que deram origem à civilização europeia: a cultura da Grécia e da Roma antigas o cristianismo e a cultura bélica e feudal dos germânicos. Em seguida, conta como essa mistura instável acabaria se rompendo e então nos guia por um panorama da Antiguidade aos dias atuais a partir de temas como formas de governo, idiomas, religiões, jogos de poder e conflitos bélicos.

Com um texto claro e bem-humorado e diversas ilustrações, o autor nos apresenta a cavaleiros e sacerdotes, alemães românticos e franceses revolucionários, camponeses e líderes geniais – todas as peças que moldaram nossa forma de pensar e nos relacionar.
História do medo no ocidente, 1300-1800;História do medo no ocidente 1300-1800;“Não temos história do amor, da morte, da piedade, da crueldade, da alegria.” A queixa de Lucien Febvre, em 1948, muito repetida desde então, tornou- se quase um manifesto da disciplina que se convencionou chamar a “história das mentalidades”. Uma das lacunas que o fundador da escola dos Annales deplorava foi preenchida pela História do medo no Ocidente, obra de 1978 e já hoje um clássico.

Ao tomar como objeto de estudo o medo, Jean Delumeau parte da ideia de que não apenas os indivíduos mas também as coletividades estão engajadas num diálogo permanente com a menos heroica das paixões humanas. Revelando-nos os pesadelos mais íntimos da civilização ocidental do século xiv ao xviii — o mar, os mortos, as trevas, a peste, a fome, a bruxaria, o Apocalipse, Satã e seu agentes (o judeu, a mulher, o muçulmano) —, o grande pensador francês realiza uma obra sem precedentes na historiografia do Ocidente.
Charles de Gaulle: Uma biografia;Charles de Gaulle;Um retrato vibrante do líder controverso mas incontestável que comandou a resistência à ocupação nazista e salvou a honra da França. Charles de Gaulle ganha aqui sua primeira reconsideração histórica de peso em vinte anos, escrita por um dos maiores especialistas na história moderna da França.

Com sua personalidade forte, o general Charles de Gaulle adentrou a história inspirando homens e mulheres a arriscarem a vida para combater o nazismo. Depois, como presidente, enfrentou revoltas nacionais e violentos movimentos de independência. Perseguindo o que chamou de “uma certa ideia da França”, desafiou a hegemonia americana, retirou a França da Otan e por duas vezes vetou a entrada da Grã-Bretanha na Comunidade Europeia. Figura gigante, cujo legado segue sendo profundamente disputado, De Gaulle ressurge em cores vivas nessa premiada biografia.

Apoiando-se em vasta pesquisa, inclusive de arquivos recém-disponibilizados, o historiador Julian Jackson explora todas as dimensões do “mistério De Gaulle”, sem buscar lhe dar excessiva coerência: revela as raízes conservadoras da formação intelectual do general, descreve com precisão e leveza seus paradoxos e ambiguidades, seu talento político, paixão pela tática, pragmatismo e capacidade de visão, e lança nova luz sobre a relação do estadista com Churchill. Uma narrativa pulsante, que capta De Gaulle como nunca antes.

Vencedor do Duff Cooper Prize for History 2018 e do Elizabeth Longford Prize for Historical Biography 2019.

“A biografia escrita por Julian Jackson é um monumento à altura dessa figura extraordinária (...), um dos personagens mais fascinantes da política do século XX. (...) O resultado é uma excelente história da França moderna disfarçada de biografia de um estadista.” ― The New York Review of Books

“Uma apresentação arrebatadora e ao mesmo tempo concisa do mais brilhante, exasperador e inefavelmente francês dos homens.” ― The New York Times

“Deixa as obras anteriores na sombra, em boa parte devido à pesquisa impecável e à sua rara capacidade de ser objetivo e atraente. (...) Uma obra-prima.” ― The Spectator
História global, Brasil e geral;História global: Brasil e geral;Retrata a história deste as pinturas rupestre, explicando a diferença de cada período da pré história até os acontecimentos mais atuais, como o Movimento dos "caras pintadas" e o governo de Fernando Henrique Cardoso.
História Do Mundo;Uma Breve História Do Mundo;"É como ver a paisagem pela janela de um trem em movimento", afirma o Prof. Geoffrey Blainey, um dos mais aclamados historiadores da atualidade. Em Uma Breve História do Mundo, o autor faz um balanço da fantástica saga da humanidade, magistralmente compilada desde seus primórdios até os frenéticos dias em que vivemos.

