Um livro essencial sobre a revolta dos explorados contra os exploradores, dos negros contra a escravidão, da América Latina contra o colonialismo, formas de opressão contra as quais se levantou a revolução haitiana. Para Jacob Gorender, autor da orelha do livro, "James se apoiou solidamente em fontes historiográficas abundantes e seguras e soube elaborar um texto fluente e cativante. O que torna este Os jacobinos negros um livro precioso não só para estudiosos especializados, mas também para todos os que desejam conhecer a História a fim de entender melhor o mundo em que vivem."

Os jacobinos negros traz ainda um apêndice onde o autor relaciona as semelhanças e diferenças entre a ressurreição hatiana e a Revolução Cubana, intitulado "De Toussaint L`Ouverture a Fidel Castro" uma cronologia da história do Haiti e um índice onomátisco e remissivo dos personagens históricos citados no livro.
Terceiro Reich na história e na memória: Novas perspectivas sobre o nazismo, seu poder político, sua intrincada economia e seus efeitos na Alemanha do pós-guerra;Terceiro Reich na história e na memória;"Uma das maiores autoridades mundiais sobre o nazismo, o historiador inglês Richard Evans, autor da trilogia que é a maior referência sobre o assunto, explica neste livro como o nosso entendimento sobre a Alemanha nazista vem se transformando no século XXI. Através de uma série de ensaios e textos, ele aborda diversos pontos que vivem sob o escrutínio. Analisa, por exemplo, a ação global de companhias alemães criadas na época do nazismo como a Volkswagen mostra como os historiadores passaram a enxergar o Holocausto não como um evento histórico único mas como um genocídio com similaridades a praticados em outros países e em outros tempos. Cada tópico é discutido em um texto separadamente, facilitando a leitura e a compreensão."
O fascismo eterno;O Fascismo Eterno;"Uma reflexão importante e necessária sobre o sentido da história e a importância da memória.

Publicado pela primeira vez em 1997, como parte do livro Cinco escritos morais, O fascismo eterno chega aos leitores em nova edição no momento de ascensão mundial do flerte com o fascismo. Segundo Umberto Eco, entre as possíveis características do Ur-Fascismo, o fascismo eterno do título, estão o medo do diferente, a oposição à análise crítica, o machismo, a repressão e o controle da sexualidade, a exaltação de um líder, um constante estado de ameaça, entre outros. O fascismo, denuncia o autor, longe de ser apenas um momento histórico vivo na Itália, na Europa (e no Brasil) do século XX, é uma ameaça constante da nossa sociedade.
Guerra Pela Eternidade: o Retorno do Tradicionalismo e a Ascensão da Direita Populista;Guerra pela eternidade;Para Benjamin R. Teitelbaum, os governos dos Estados Unidos, do Brasil e da Rússia são influenciados por três intelectuais com forte ação nas instituições governamentais: Steve Bannon, Olavo de Carvalho e Aleksandr Dugin. Com atuações diferentes, os três contam com discípulos nos quadros do governo e têm em comum uma obscura doutrina intelectual, o Tradicionalismo. Seus preceitos fazem críticas à modernidade, que seria responsável pelo declínio da espiritualidade e da influência religiosa nas instituições, tornando necessária uma verdadeira “batalha espiritual” para pôr fim a valores que remontam ao Iluminismo. Elaborado a partir de entrevistas, o livro traça um contexto histórico detalhado e aborda aspectos de enorme interesse para o público brasileiro, como a atuação do governo Bolsonaro nas relações internacionais e suas consequências nos laços comerciais do Brasil com importantes parceiros, como a China. Uma leitura obrigatória para qualquer pessoa que queira entender a visão da extrema direita e sua atuação no mundo.

Benjamin R. Teitelbaum é professor de etnomusicologia e assuntos internacionais na Universidade do Colorado, em Boulder (EUA). Obteve seu doutorado pela Universidade de Brown, com estudos auxiliares na Academia Real de Música de Estocolmo, Suécia, e na Universidade de Harvard.
A Ditadura Encurralada;A Ditadura Encurralada (Coleção Ditadura #4);Gaspari se tornou depositário de cinco mil documentos do Arquivo Golbery e do diário de Heitor Ferreira, secretário particular de Geisel, "o sacerdote", e de Golbery, "o feiticeiro" para escrever ´A ditadura derrotada´ - primeiro volume do tríptico ´O sacerdote e o feiticeiro´ - obra espetacular, já que trata de conversas e de assuntos cujo conteúdo nem mesmo os envolvidos sabiam. Num dos trechos mais importantes de ´A ditadura derrotada´ fica-se sabendo que Geisel, antes de ser empossado em fevereiro de 1974, ouviu do general Dale Coutinho que o "negócio" - a repressão à subversão - "melhorou quando começamos a matar", numa referência ao fim dos "confrontos armados" e dos "suicídios" suspeitos e ao surgimento da figura do "desaparecido". "Ó Coutinho", disse o futuro presidente, "esse troço de matar é uma barbaridade mas eu acho que tem que ser." Disse isso com a mesma simplicidade com que repeliu o golpe dentro do golpe, ao vê-lo se desenhando após a vitória da oposição nas eleições de 1974. "Pois não fizemos uma eleição? É isso e pronto!" O resto das revelações fica para esta grande obra intitulada A ditadura encurralada, novo volume de ´O sacerdote e o feiticeiro´, cobrindo até a demissão do general Sylvio Frota, em 1977, pá de cal no autoritarismo. .
Formação do Brasil contemporâneo;Formação do Brasil Contemporâneo;O passado colonial do Brasil - cuja razão de ser era a produção em larga escala visando o mercado externo, com sua necessária dependência do trabalho escravo - está impresso nas instituições econômicas, políticas e sociais de hoje. Anacronismos e tradições persistem retardando o pleno desenvolvimento do país. 'Formação do Brasil contemporâneo' traz os seguintes temas - Sentido da Colonização Povoamento Povoamento interior Correntes de povoamento Raças Economia Grande lavoura Agricultura de subsistência Mineração Pecuária Produções extrativas Artes e indústria Comércio Vias de comunicação e transporte Organização social Administração Vida social e política.
Todos contra todos: o ódio nosso de cada dia;Todos Contra Todos;Leandro Karnal derruba o mito do brasileiro pacífico. “Só eu e você, caro leitor, cara leitora, não odiamos nem somos violentos, muito menos preconceituosos”, diz Karnal. Uma brincadeira irônica para mostrar o quanto transferimos para o outro o que temos de ruim. Um livro polêmico, provocativo e instigante no qual ele afirma que o ódio é um dos espelhos mais poderosos para olharmos nosso próprio rosto. Que a maldade é tão próxima do ódio quanto da inveja.

Em tempos de coxinhas contra petralhas, xenófobos contra imigrantes, o novo feminismo e os movimentos LGBT, em tempos do politicamente correto contra os seus críticos mais mordazes, Leandro Karnal mostra que a história e a realidade revelam um lado sombrio do brasileiro que costumamos não reconhecer: somos violentos no trânsito, nas ruas, nos comentários das redes sociais e fofocas nas esquinas somos violentos ao torcer por nosso time e ao votar somos violentos cotidianamente.

Em “Todos Contra Todos”, Leandro Karnal combina as características que o transformaram no historiador mais pop do Brasil: erudição e leveza, profundidade e humor. Elas se unem nas páginas deste livro para serem saboreadas pelos leitores. Todos contra todos escancara a polêmica das palavras agressivas, a natureza das reações raivosas dirigidas ao outro e o porquê de escondermos de nós mesmos as pequenas e grandes maldades do dia a dia.
Devassos no Paraíso;Devassos no paraíso;O livro mais completo sobre a história da homossexualidade brasileira, em edição revista e ampliada.

Num frutífero diálogo com diversos campos de conhecimento e expressões de nossa cultura — o cinema, o teatro, a política, a história, a medicina, a psicologia, o direito, a literatura, as artes plásticas etc. —, João Silvério Trevisan constrói o mais completo estudo sobre a homoafetividade no Brasil.

Considerado um clássico, passou por mais de uma geração, provocou intensa interlocução com a comunidade LGBT e influenciou desde ações emancipatórias até novos estudos e abordagens sobre gênero e sexualidade. Agora, esse monumental trabalho chega à sua quarta edição trazendo mais capítulos, imagens e texto atualizado sobre as lutas e conquistas dos direitos LGBT ocorridas no século XXI.

O tabu da homossexualidade é um dos mais sólidos entraves morais de nossa sociedade. Ativista pioneiro do movimento LGBT, Trevisan produziu uma obra apaixonada e engajada porque acredita que, assim como cada discurso homofóbico alimenta a violência e a intolerância, toda consciência que se movimenta em busca da emancipação inspira outras consciências. E será desse jeito que uma sociedade mais justa e menos homofóbica surgirá.

é, ao mesmo tempo, sério, informativo e divertido. — Peter Burton,
História da América Latina;Guia Politicamente Incorreto da América Latina;A coleção Guia politicamente incorreto escolhe seu novo alvo: o falso herói latino-americano. Tudo neste livro é contra as regras batidas com as quais se conta a história da América Latina. Não nos sentimos representados por guerrilheiros ou por indignados líderes andinos e suas roupas coloridas. Não há aqui destaque para veias abertas do continente, mas para feridas devidamente tratadas e curadas com a ajuda de grandes potências. Conhecemos bem as tragédias que nossos antepassados índios e negros sofreram - mas, honestamente, estamos cansados de falar sobre elas. E acreditamos que todos os povos passaram por desgraças semelhantes, inclusive aqueles que muitos de nós adoram acusar. Na história de quase todo país, é comum abrilhantar as palavras de figuras públicas e até inventar virtudes de seu caráter - e não passa de chatice ficar insistindo numa realidade menos interessante. Acontece que na América Latina se vai além: escolhem-se como heróis justamente os homens que mais atrapalharam a política, mais arruinaram a economia, mais perseguiram os cidadãos. Por isso, não há como escapar: é ele, o falso herói latino-americano, o principal alvo deste livro.
O Espírito do Guerreiro;O Espírito do Guerreiro;As guerras existem desde o princípio dos tempos. Mas o que há em comum entre os bravos guerreiros espartanos e os soldados contemporâneos? O que define o Espírito do Guerreiro? Como transportar esse espírito para as batalhas internas que atingem todos nós? Neste livro, o escritor de tantas guerras Steven Pressfield fala de honra, coletividade, bravura, dignidade, abnegação. E, claro, desejo de vitória.

História
A era das revoluções: 1789-1848;A Era das Revoluções;Hobsbawn mostra, neste livro, como a Revolução Francesa e a Revolução Industrial inglesa abriram o caminho para a renascença das ciências, da filosofia, da religião e das artes mas não conseguiram resolver os impasses criados pelas fortes contradições sociais, que transformaram este período numa conturbada fase de movimentos revolucionários.

História / História Geral
A Ditadura Derrotada;A Ditadura Derrotada (Coleção Ditadura #3);Geisel ( o Sacerdote) e Golbery ( o Feiticeiro) formaram uma parceria sem precedentes na história do Brasil. Era uma amizade a serviço. Começava e terminava no Planalto. Geisel era o presidente da República e Golbery, seu chefe do Gabinete Civil. Não se frequentavam, não almoçavam juntos. Contam-se nos dedos as ocasiões em que Golbery foi ao palácio da Alvorada e aquelas em que Geisel o visitou na granja do Ipê, onde morava. Os dois generais aproximaram-se durante o primeiro governo da ditadura, quando Geisel, com 56 anos, chefiou o Gabinete Militar do presidente Castello Branco e Golbery, com 52, fundou e dirigiu o Serviço Nacional de Informações. Voltaram ao poder no dia 15 de março de 1974. Tinham o propósito de desmontar a ditadura radicalizada desde 1968, com a edição do Ato Institucional 5. Queriam restabelecer a racionalidade e a ordem. Geisel recebeu uma ditadura triunfalista, feroz contra os adversários e benevolente com os amigos. Decidiu administrá-la de maneira que ela se acabasse. Não fez isso porque desejava substituí-la por uma democracia. Assim como não acreditava na existência de uma divindade na direção dos destinos do universo, não dava valor ao sufrágio universal como forma de escolha de governantes. Queria mudar porque tinha a convicção de que faltavam ao regime brasileiro estrutura e força para se perpetuar. Em dois outros livros (A ditadura envergonhada e A ditadura escancarada) procurei contar a história do consulado militar desde a deposição do presidente João Goulart, em 1964, até a caçada dos guerrilheiros do Partido Comunista do Brasil, nas matas do Araguaia, em 74. Neste, vão narradas as vidas de Geisel e Golbery, a articulação que os levou ao Planalto, a formação do governo e seu caminho até a eleição de 1.974, na qual a ampla e inesperada vitória da oposição alterou o curso da ditadura.

# Esta obra trata-se do terceiro livro da coleção e primeiro volume da série O Sacerdote e o Feiticeiro ( que dá seqüência aos livros de As Ilusões Armadas)
Sobreviventes e guerreiras: Uma breve história da mulher no brasil de 1500 a 2000;Sobreviventes e guerreiras;“Enquanto você lê este livro, a cada duas horas uma mulher é assassinada.” É assim que a historiadora Mary del Priore começa Sobreviventes e guerreiras. Uma obra essencial para se entender o porquê de, até hoje, ser fundamental discutir e, principalmente, lutar pela igualdade de direitos para o gênero feminino. Apesar de o Brasil já até ter tido uma presidenta e de 45% dos lares serem comandados por mulheres (segundo pesquisa do IPEA de 2018), a brasileira continua sendo agredida, desqualificada, perseguida, insultada. Vivemos uma época de transição onde o patriarcado e o machismo, raízes desses séculos de desigualdade, são combatidos pelo feminismo e pela cultura contemporânea. Mas, para que uma nova ordem social se torne realidade, é preciso procurar no passado as raízes deste poder dos homens sobre as mulheres e, sobretudo, aprender com elas como se fizeram ouvidas. A história mostra que a brasileira sempre procurou se reinventar, achar um espaço, resistir. Este livro traz um ineditismo ao focar nessas vozes, apresentando a história da mulher brasileira 1500 a 2000. Das indígenas que os portugueses encontraram por aqui às afrodescendentes daquelas que pegaram na enxada e viveram nos campos e cafezais às que trabalhavam na casa-grande como escravas, empregadas e amas de leite das operárias e trabalhadoras às artistas de rádio, cinema e televisão de Cláudia Lessin Rodrigues e Aída Curi à Daniella Perez e Marielle Franco das feministas às homossexuais e integrantes do movimento LGBTQI+. Todas resistiram – e Mary del Priore apresenta suas vozes e como aprender com o exemplo delas.
História do Brasil Império;Evolução política do Brasil;Livro de grande interesse para historiadores,sociólogos,geógrafos , economistas e o público em geral.

A capa da 6a, edição difere da capa inserida neste cadastramento.

Economia, Finanças / História / História do Brasil / Sociologia
Bhagavad Gita: Texto Clássico Indiano;Bhagavad Gita;Uma das obras-primas da poesia épica indiana, a composição mais popular da Índia e a obra hindu mais lida em todo o mundo! A Bhagavad Gita é um verdadeiro tratado de yoga, tão valioso quanto os Yoga Sutra s, de Patanjali. Entendida como o cântico que se tornou um dos pilares do Hinduísmo religioso, a Bhagavad Gita é o episódio mais famoso do grande épico indiano, o Mahabharata. Esta clássica narrativa, que retrata o diálogo entre Krishna e o guerreiro Arjuna, apresenta respostas para as questões fundamentais da vida, traz à tona a universalidade e a atemporalidade de seus ensinamentos e continua a inspirar uma ampla variedade de interpretações, tanto no Oriente quanto no Ocidente. A presente tradução preserva toda a força e a beleza da linguagem original deste poema inspirador e traz um significativo diferencial em relação a muitas outras: ela respeitosamente extrapola os contextos religioso e devocional ao considerar a abordagem que percebe a Bhagavad Gita como um tratado doutrinário de yoga.
História antiga;A Cidade Antiga (A Obra-Prima De Cada Autor #02);Fustel de Coulanges (1830 - 1889) é um historiador francês que ocupou a cadeira de História da Idade Média na Sorbonne e dirigiu a École Normale Supérieure.

Sua Obra-prima é "La Cité Antique" (1864), onde explica o estudo do passado como um encadeamento lógico dos fatos, elaborando assim um método científico. Nesse estudo, Coulanges apresenta a história civil do mundo greco-romano centralizada toda no culto aos mortos.

A Cidade Antiga é um livro de leitura obrigatória.

História / História Geral / Política / Sociologia / Literatura Estrangeira
O novo Iluminismo: Em defesa da razão, da ciência e do humanismo;O Novo Iluminismo;Com profundidade analítica e talento literário, Steven Pinker defende a razão, a ciência e o humanismo, os ideais de que precisamos para enfrentar os nossos problemas e dar continuidade ao nosso progresso.Em O novo Iluminismo, uma original avaliação da condição humana no terceiro milênio, o cientista cognitivo Steven Pinker nos incita a rechaçar manchetes alarmistas e profecias apocalípticas, que vicejam nos dias atuais e influenciam nossa visão de mundo. Com 75 gráficos impressionantes, ele demostra que a vida, a saúde, a prosperidade, a segurança, a paz, o conhecimento e a felicidade estão em ascensão, não apenas no Ocidente, mas em todo o mundo. Para Pinker, esse progresso é uma herança do Iluminismo: a convicção de que a razão e a ciência podem impulsionar o florescimento humano — e, mais do que nunca, elas precisam de uma defesa vigorosa. Nadando contra as correntes da natureza humana exploradas por demagogos — tribalismo, autoritarismo, demonização, pensamento mágico —, o projeto iluminista é atacado por religiosos, políticos e intelectuais pessimistas que insistem que a civilização ocidental passa por um inexorável processo de declínio. Mas basta olhar os dados: eles indicam que, com o avanço do conhecimento, as pessoas estão de fato vivendo mais e melhor. Sem negar que nossos tempos são atribulados, Steven Pinker não hesita em apontar o caminho para as soluções: reforçar o ideal iluminista de usar a razão e a ciência para resolver problemas.
Os fornos de Hitler: A história de uma sobrevivente de Auschwitz;Os Fornos De Hitler;A história real de uma mulher sobrevivente de Auschwitz. Olga escreveu este livro com a leveza de um diário – apesar de nunca ter sido. Nele, ela conta em detalhes como era a vida no campo, mostrando com clareza e simplicidade o horror cometido pelos alemães.

Olga Lengyel conta, de forma sincera e aberta, uma das histórias mais horripilantes de todos os tempos. Este relato verdadeiro e documentado é o registro íntimo e diário de uma mulher que sobreviveu ao pesadelo de Auschwitz e Birkenau. Uma experiência relatada de maneira chocante.
Escola De Frankfurt;A Escola de Frankfurt;Sem jargão acadêmico e narrado de forma a prender a atenção do leitor, o livro traça uma reconstrução crítica, entrecruzando biografias, a história do Instituto, a evolução das teorias e a descrição do meio científico, assim como o pano de fundo social e político.
O Mapa da Mina: a Guerra dos Conglomerados Globais de Mineração Pela Conquista da Carajás Africana;O Mapa da Mina;Este livro representa uma rara oportunidade para o leitor observar entranhas do mundo dos negócios normalmente inacessíveis ao público. Não trata de um negócio qualquer, mas da disputa intrincada e bilionária em torno do controle de uma mina de minério na Guiné. O jornalista André Guilherme Vieira, um dos mais experientes e relevantes repórteres do mundo das investigações judiciais no país, traz à luz detalhes sobre o comportamento de uma das mais poderosas empresas do país, a Vale. Por si só, isso já garantiria interesse na obra. Mas ela vai além, ao contar, em ritmo de thriller, uma história surpreendente. O litígio tem sido relatado aqui e ali pela imprensa, mas o aprofundamento obtido pelo autor a partir da leitura de milhares de páginas de processos apresenta – como se ele próprio estivesse escavando uma mina – camadas até então desconhecidas. Em certo trecho do livro, um dos personagens diz que a briga por uma parte da mina “vai ser feia” e “sugere uma estratégia bastante agressiva, com envolvimento político do governo”. Sem isso, diz ele, “somos carta fora do baralho”. Com seu livro, André Guilherme Vieira convida o leitor a presenciar de perto uma grande e arriscada rodada de pôquer com todas as cartas à mesa. Boa partida, boa leitura.
Babilônia: A mesopotâmia e o nascimento da civilização;Babilônia;Em Babilônia, Paul Kriwaczek conta a história da antiga Mesopotâmia, desde as primeiras povoações, em torno de 5400 a.C., até a chegada dos persas no século VI a.C. O autor faz a crônica da ascensão e queda do reino babilônico durante esse período e analisa suas numerosas inovações materiais, sociais
e culturais.

O povo da Mesopotâmia lançou as bases do que hoje conhecemos como civilização – com o nascimento da escrita, do estado centralizado, da divisão do trabalho, da religião organizada, da matemática e da lei, entre muitas outras coisas
fundamentais que nos servem até hoje. Nas cidades que construíram se desenrolou metade da história humana.

No cerne da magistral narrativa de Kriwaczek está a glória da Babilônia — “o portal dos deuses” —, que teve seu apogeu no reinado do soberano amorita Hamurábi, que unificou a cidade entre 1800 e 1750 a.C. Embora o poder babilônico viesse a crescer e depois declinar nos séculos seguintes, a Babilônia preservou sua importância como centro cultural, religioso e político por mais de 4 mil anos.
Você Foi Enganado. Mentiras, Exageros e Contradições dos Últimos Presidentes do Brasil;Você foi enganado;Sim. Você foi enganado. Ao longo da história do Brasil, candidatos à Presidência da República, vice-presidentes e presidentes eleitos faltaram com a verdade na hora de se dirigir à população. Independentemente de partido, se não mentiram, muitas vezes optaram por omitir dados ou induzir os cidadãos a conclusões equivocadas sobre o cenário político. Em Você foi enganado, os jornalistas Cristina Tardáguila e Chico Otavio apresentam uma seleção de casos que marcaram nossa história, desde 1920 até os dias atuais. Estão no livro episódios emblemáticos envolvendo quinze presidentes: documentos forjados para sugerir uma ameaça comunista fotos posadas para omitir o grave estado de saúde de governantes e presidentes que, eleitos, fizeram o oposto do que prometeram veementemente durante o processo eleitoral. Como os autores fazem questão de mostrar, essa característica não é exclusiva da política nacional, mas está presente em diversos países e em diferentes momentos ao longo da história.
O Brasil contra a democracia: A ditadura, o golpe no Chile e a Guerra Fria na América do Sul;O Brasil contra a democracia;Uma nova história sobre a política do Brasil na América do Sul dos anos 1970, que captura o leitor desde as primeiras linhas.

Baseado em extensa pesquisa documental e escrito com brilho, O Brasil contra a democracia demonstra como a ditadura brasileira agiu para derrubar a democracia chilena e serviu de apoio ― e modelo ― na construção do regime militar sob Augusto Pinochet. Essa intervenção não foi fruto de ações episódicas e autônomas, mas de uma política de Estado.
Neste livro, Roberto Simon desmonta a imagem do país como servente fiel, automaticamente alinhado a Washington: o regime militar brasileiro tinha suas motivações ― geopolíticas, domésticas, ideológicas, econômicas ― para intervir no Chile. Por outro lado, refuta a tese de que a ação do Brasil no Chile teria sido iniciativa de alguns radicais dentro do regime e mostra como o Itamaraty era parte fundamental da repressão a brasileiros fora do território nacional, espionando e perseguindo exilados.
O Brasil contra a democracia é um divisor de águas na historiografia do período e um clássico imediato.
Nós, mulheres: Grandes vidas femininas;Nós, mulheres;Um livro fundamental à reivindicação do papel feminino nos principais avanços da humanidade através da biografia de suas protagonistas. Grandes e célebres figuras estão presentes, de Agatha Christie a Simone de Beauvoir. Mas não só. Mulheres menos conhecidas também são retratadas, como Mary Anning, primeira paleontóloga da História, e Juana Azurduy, que liderou exércitos contra os espanhóis.

Biografia, Autobiografia, Memórias / História
