Sapiens;Sapiens;Há 100 mil anos, pelo menos seis espécies de humanos habitavam a Terra. Hoje, existe uma única.
Nós.
Os Homo sapiens.
Como conquistamos o planeta? Por que nossos ancestrais se reuniram para criar cidades, reinos e impérios? Como passamos a creditar em deuses, nações e direitos humanos a confiar no dinheiro, em livros e leis e a ser escravizados pela burocracia, pelo comunismo e pela incessante busca da felicidade? Que papel teve nisso tudo nossa capacidade imaginativa?

Originalíssimo, abrangente, delicioso de ler, provocativo e por vezes perturbador, Sapiens: uma breve história da humanidade desafia tudo o que pensávamos que sabíamos sobre o que significa ser humano: nossas crenças, nossas ações, nosso poder... e até mesmo nosso futuro.
21 lições para o século 21;21 lições para o século 21;Num mundo repleto de informações irrelevantes, clareza é poder. Se não há mais restrição ao fluxo de ideias, a lógica da censura parece ter sido subvertida: o excesso de conteúdo a que as pessoas são expostas diariamente inunda-as de desinformação e distrações. 21 lições para o século 21 faz um travessia por essas águas turvas e confronta alguns dos temas mais urgentes da agenda global.

Se em Sapiens Yuval Noah Harari examinou com profundidade o passado do gênero humano e em Homo Deus imaginou nossa existência num futuro dominado por algoritmos, neste livro ele se concentra nos grandes dilemas e escolhas do presente.

Por que a democracia liberal está em crise? O que significa a eleição de Donald Trump? O que podemos fazer quanto à epidemia de fake news? Qual civilização domina o mundo - o Ocidente, a China, o Islã? Deve a Europa manter suas portas abertas a imigrantes? O nacionalismo é capaz de resolver os problemas de desigualdade e das mudanças climáticas? Como lidar com o terrorismo? O que ensinar a nossos filhos?

Com base nos debates explorados nos dois livros anteriores, aqui Harari destrincha questões políticas, tecnológicas, sociais e existenciais, e aponta como elas impactam a vida cotidiana dos humanos de todo o mundo, Ao apresentar de maneira clara e acessível os desafios contemporâneos, o brilhante historiador nos convida a refletir sobre qual deve ser o nosso envolvimento pessoal num momento de tantos ruídos e incertezas.
Brasil: Uma Biografia;Brasil: Uma Biografia;Aliando texto acessível e agradável, vasta documentação original e rica iconografia, Lilia Moritz Schwarcz e Heloísa Starling propõem uma nova (e pouco convencional) história do Brasil.

Nessa travessia de mais de quinhentos anos, se debruçam não somente sobre a grande história mas também sobre o cotidiano, a expressão artística e a cultura, as minorias, os ciclos econômicos e os conflitos sociais (muitas vezes subvertendo as datas e eventos consagrados pela tradição). No fundo da cena, mantêm ainda diálogo constante com aqueles autores que, antes delas, se lançaram na difícil empreitada de tentar interpretar ou, pelo menos, entender o Brasil.

A história que surge dessas páginas é a de um longo processo de embates e avanços sociais inconclusos, em que a construção falhada da cidadania, a herança contraditória da mestiçagem e a violência aparecem como traços persistentes.

As autoras, com singular competência, conseguem aliar clareza e consistência, densidade e fluidez, rigor histórico e prazer do texto. — Lira Neto, autor de Getúlio.

Este livro é uma biografia não autorizada de um personagem complexo chamado Brasil. Ele combina com muita qualidade várias facetas desse personagem que se forma e se transforma ao longo de mais de cinco séculos, e continua se transformando até onde a vista pode alcançar. Boris Fausto, autor de História do Brasil"
O polímata: Uma história cultural de Leonardo da Vinci a Susan Sontag;O polímata;De Leonardo Da Vinci a John Dee e Comenius, de George Eliot a Oliver Sacks e Susan Sontag, os polímatas moveram as fronteiras do conhecimento de inúmeras maneiras. Mas a história pode ser cruel para estudiosos com tais interesses enciclopédicos. Com muita frequência, esses indivíduos são lembrados apenas por uma parte de suas valiosas realizações. Neste relato envolvente e erudito, Peter Burke defende uma visão mais global. Identificando quinhentos polímatas ocidentais, Burke explora seus estudos abrangentes e mostra como a ascensão desses intelectuais correspondeu a um rápido crescimento do conhecimento nas eras da invenção da impressão, da descoberta do Novo Mundo e da Revolução Científica. Só mais recentemente é que a aceleração do conhecimento levou a uma maior especialização e a um ambiente que dá menos apoio a acadêmicos e cientistas de amplo espectro. Abordando desde a Renascença até os dias atuais, Burke muda nossa compreensão dessa notável espécie de intelectual.
Sobre o autoritarismo brasileiro;Sobre o Autoritarismo Brasileiro;Valendo-se de uma ampla reunião de dados estatísticos, Lilia M. Schwarcz examina algumas das raízes do autoritarismo brasileiro, bastante antigas e arraigadas, embora frequentemente mascaradas pela mitologia nacional. Os brasileiros gostam de se crer diversos do que são. Tolerantes, abertos, pacíficos e acolhedores são alguns dos adjetivos que habitam frequentemente a mitologia nacional. Neste livro urgente e necessário, Lilia M. Schwarcz reconstitui a construção dessa narrativa oficial que acabou por obscurecer uma realidade bem menos suave, marcada pela herança perversa da escravidão e pelas lógicas de dominação do sistema colonial. Ao investigar esses subterrâneos da história do país ― e suas permanências no presente ― a autora deixa expostas as raízes do autoritarismo no Brasil, e ajuda a entender por que fomos e continuamos a ser uma nação muito mais excludente que inclusiva, com um longo caminho pela frente na elaboração de uma agenda justa e igualitária.
O livro da história;O Livro da Filosofia (As Grandes Ideias de Todos os Tempos #1);O Livro da Filosofia traz uma coleção de idéias fundamentais para um mergulho no pensamento filosófico. Engana-se quem pensa que por se tratar de uma compilação a abordagem é simplista e somente voltada a leigos: o livro é completo, instigante e oferece a leitores com diferentes perfis informação de qualidade em apresentação gráfica inovadora. Um verdadeiro convite ao exercício do pensar — o verdadeiro objetivo da filosofia.
Organizado de maneira sincrônica, o que permite cobrir da Antiguidade ao momento Contemporâneo, o livro é composto por capítulos organizados em torno de máximas dos grandes expoentes da filosofia. A partir dessas máximas, o pensamento é destrinchado e posto em diálogo com as discussões do momento histórico em questão e com outras épocas e perspectivas. Assim, em único livro, visões e teorias conflitantes são postas lado a lado, mostrando que a prática da filosofia não se faz de pensamentos estáticos, mas de uma atividade cotidiana na qual se questiona o viver e suas contradições, expectativas e temores.
O leitor terá a chance de perceber que a filosofia é, sim, um modo de pensar e estar no mundo, priorizando as principais características humanas: curiosidade, discernimento e raciocínio. Roland Barthes, um dos filósofos abordados, lembrou que saber e sabor partem de uma mesma etimologia e, portanto, caminham juntos. Se a busca pelo conhecimento deve trazer entusiasmo e alegria, O Livro da Filosofia nos oferece em abundância essas recompensas.
Os porões da contravenção;Os Porões da Contravenção;Este livro-reportagem é daqueles raros que esgota – destrincha até não sobrar dúvida – o assunto a que se dedica: a histórica e macabra sociedade entre jogo do bicho e ditadura militar. Seus personagens principais, Anísio, o “papai” da Beija-Flor, Castor de Andrade, o benfeitor da Mocidade Independente, e Capitão Guimarães, militar e torturador dos calabouços da ditadura, cresceram e apareceram (não sem muito sangue) no ambiente terrivelmente favorável dessa parceria. Neste Os porões da contravenção, Aloy Jupiara e Chico Otavio recriam a fauna de terror em que os bicheiros foram buscar os braços que lhes garantiriam segurança, território e organização. E vão muito além de escancarar – o que por si só já representaria um marco jornalístico – as manobras por meio das quais o regime não apenas protegeu, mas permitiu e mesmo estimulou, o desenvolvimento sustentável do crime organizado no Rio de Janeiro e, logo, no Brasil.
História do Brasil;Guia Politicamente Incorreto da História do Brasil;O jornalista Leandro Narloch levantou estudos recentes sobre a História do Brasil para reavaliar conceitos arraigados - o ideal do bom selvagem e o massacre da Guerra do Paraguai, por exemplo - e desconstruir mitos - alguns dos autores mais incensados da Língua Portuguesa, como Machado de Assis. O resultado de pesquisas de historiadores que não se renderam à educação tradicional à qual todos somos passados a ferro na escola surge no livro "Guia Politicamente Incorreto da História do Brasil" num texto bem humorado e fluido que nos leva a refletir sobre os papéis de mocinho e bandido. Baseado em farta bibliografia, Narloch revê o Brasil e traz a luz histórias que poderiam ficar restritas às estantes especializadas das livrarias. O livro está dividido em nove capítulos: Índios, Negros, Escritores, Samba, Guerra do Paraguai, Aleijadinho, Acre, Santos Dumont e Comunistas. Sem negar as qualidades ou os erros que a História do país e alguns brasileiros acumularam ao longo de cinco séculos, Narloch propõe um olhar mais curioso e menos acomodado.
O Banquete;O Banquete;O Banquete é a celebração e o louvor de Eros. Platão, com dramatismo e suma habilidade literária, propõe nos diversos discursos (de Ágaton, Aristófanes, etc.) conceitos vários sobre o Amor que são negados ou superados na narração de Sócrates acerca de Diotima. Eros é o intermediário entre o humano e o divino: através de todas as formas do belo arrasta e impele para a Beleza supra-sensível.





Filosofia
Raízes do Brasil;Raízes do Brasil;Nunca será demasiado reafirmar que Raízes do Brasil inscreve-se como uma das verdadeiras obras fundadoras da moderna historiografia e ciências sociais brasileiras. Tanto no método de análise quanto no estilo da escrita, tanto na sensibilidade para a escolha dos temas quanto na erudição exposta de forma concisa, revela-se o historiador da cultura e ensaísta crítico com talentos evidentes de grande escritor. A incapacidade secular de separarmos vida pública e vida privada, entre outros temas desta obra, ajuda a entender muito de seu atual interesse. E as novas gerações de historiadores continuam encontrando, nela, uma fonte inspiradora de inesgotável vitalidade. Todas essas qualidades reunidas fizeram deste livro, com razão, no dizer de Antonio Candido, "um clássico de nascença".
A máquina do ódio: Notas de uma repórter sobre fake news e violência digital;A Máquina do Ódio;O relato de uma das maiores jornalistas da atualidade sobre as ameaças à liberdade de imprensa no Brasil e no mundo.

Em A máquina do ódio, Patrícia Campos Mello discute como as campanhas de difamação podem ser consideradas uma nova forma de censura, terceirizada e difundida pelos exércitos de trolls patrióticos repercutidos por robôs no Twitter, Facebook, Instagram e WhatsApp ― cujas principais vítimas são jornalistas mulheres.

Dias antes do segundo turno da eleição de 2018, ela publicou a primeira de uma série de matérias sobre o financiamento de disparos em massa no WhatsApp e de redes de disseminação de notícias falsas, na maioria em benefício do então candidato Jair Bolsonaro. Desde então, a repórter se tornou alvo de violentos ataques intimidatórios por parte do chamado gabinete do ódio e de suas milícias digitais.

Patrícia também acompanhou a utilização crescente das redes sociais nas eleições internacionais que cobriu: nos Estados Unidos, em 2008, 2012 e 2016 na Índia, em 2014 e 2019. À experiência de observadora do avanço dos tecnopopulistas e seu “manual para acabar com a mídia crítica”, somou-se a de protagonista involuntária no front de uma guerra contra a verdade.

Em meio à ascensão de governos exímios em manipular os fatos e no contexto da terrível pandemia de Covid-19, a imprensa tem uma oportunidade única de renascer. Relato envolvente de um dos capítulos mais turbulentos de nossa história recente, A máquina do ódio é também um manifesto em defesa da informação.

“Graças ao trabalho desbravador de algumas jornalistas, nós pudemos descobrir e entender como a internet contribuiu para propagar movimentos contrários à democracia. Dentre elas, destacam-se a indiana Rana Ayyub, a britânica Carole Cadwalladr e a brasileira Patrícia Campos Mello. É simples: se você quer entender os desafios atuais para a democracia no mundo, você precisa ler este livro.” ― Jason Stanley, professor de filosofia na Universidade Yale e autor de Como funciona o fascismo

“Para entender a natureza dos riscos que ameaçam a democracia brasileira hoje, é preciso seguir o rastro da conspiração digital que simula movimentos de apoio popular e fabrica ódio contra pessoas e instituições. O livro de Patrícia Campos Mello desvenda esse mundo das sombras com um texto envolvente e esclarecedor. Recomendo fortemente a leitura. E quanto antes, melhor.” ― Miriam Leitão
Livro Dos Mortos Do Antigo Egito, O;O Livro dos Mortos do Antigo Egito;Tradução do conjunto de orações necessárias à alma recém-falecida, para que ela possa chegar ao tribunal de Osíris, onde se dará seu julgamento final.

Religião e Espiritualidade / Esoterismo / História
A bailarina da morte: A gripe espanhola no Brasil;A bailarina da morte;No início do século XX, uma doença chegou ao Brasil a bordo de navios vindos da Europa. A gripe espanhola, como ficou conhecida a explosão pandêmica de uma mutação particularmente letal do vírus H1N1, matou dezenas de milhares de pessoas no país e cerca de 50 milhões no mundo inteiro.
Altamente contagiosa, a moléstia atingiu todas as regiões brasileiras. A "influenza hespanhola" paralisou a economia e desnudou a precariedade dos serviços de saúde. Disputas políticas e atitudes negacionistas de médicos e governantes potencializaram o massacre, que vitimou sobretudo os pobres. Iludida por estatísticas maquiadas e falsas curas milagrosas, a população ficou à mercê do vírus até o súbito declínio da epidemia, no começo de 1919.
A partir de um vasto acervo de fontes e imagens da época, Lilia Moritz Schwarcz e Heloisa Murgel Starling recriam o cotidiano da vida e da morte durante o reinado de terror da "gripe bailarina", uma das maiores pandemias da história.
"Um atestado visceral de que não se lembrar da própria história é condenar-se a repeti-la. Nesta história com toques de ciência e por vezes ciência em contexto histórico, temos uma oportunidade para reconhecer que já estivemos aqui antes, numa pandemia que de fato concluiu um século. Quem sabe desta vez aprendemos a lição?" -- Suzana Herculano-Houzel
"Entre negação da ciência, curas milagrosas e uma doença que escancarou as desigualdades sociais da época, os historiadores do futuro, ao analisar a brilhante obra de Lilia Moritz Schwarcz e Heloisa Murgel Starling sobre a pandemia de 1918 -- escrita durante a pandemia de 2020 --, indagarão, perplexos: Mas como pode ser possível que, em cem anos, não aprenderam nada?" -- Natalia Pasternak
"Em um mundo já fragilizado pela Primeira Grande Guerra, a gripe espanhola colocou em evidência a vulnerabilidade humana diante de um novo vírus. Este livro narra com maestria as rotas e a velocidade de disseminação da doença, ao mesmo tempo em que acentua as dificuldades e os equívocos para seu enfrentamento no Brasil oligárquico da Primeira República. Convida-nos a refletir sobre o valor da imaginação histórica para a abordagem da crise contemporânea." -- Nísia Trindade Lima
1889: Como um imperador cansado, um marechal vaidoso e um professor injustiçado contribuíram para o fim da Monarquia e a Proclamação da República no Brasil;1889;Nas últimas semanas de 1889, a tripulação de um navio de guerra brasileiro ancorado no porto de Colombo, capital de Ceilão (atual Siri Lanka), foi pega de surpresa pelas notícias alarmantes que chegavam do outro lado do mundo. O Brasil havia se tornado uma república.

O império brasileiro, até então tido como a mais sólida, estável e duradoura experiência de governo na América Latina, com 67 anos de história, desabara na manhã de quinze de novembro. O austero e admirado imperador Pedro II, um dos homens mais cultos da época, que ocupara o trono por quase meio século, fora obrigado a sair do país junto com toda a família imperial. Vivia agora exilado na Europa, banido para sempre do solo em que nascera.

Enquanto isso, os destinos do novo regime estavam nas mãos de um marechal já idoso e bastante doente, o alagoano Manoel Deodoro da Fonseca, considerado até então um monarquista convicto e amigo do imperador deposto. Essas e outras histórias surpreendentes estão 1889, o novo livro do premiado escritor Laurentino Gomes. A obra, que trata da Proclamação da República, fecha uma trilogia iniciada com 1808, sobre a fuga da corte portuguesa de Dom João para Rio de Janeiro, e continuada com 1822, sobre a Independência do Brasil.

Somados, os dois livros venderam mais de 1,5 milhão de exemplares no Brasil e ganharam quatro prêmios Jabuti, o mais prestigiado da literatura brasileira. Com 24 capítulos e ricamente ilustrado, 1889 contribui para a compreensão de um dos períodos mais controversos da história do país, em um relato cativante que explica não só os acontecimentos que levaram à queda da monarquia, em 1889, mas também outros episódios importantes da história brasileira como a Guerra do Paraguai e o movimento abolicionista.
1822: Como um homem sábio, uma princesa triste e um escocês louco por dinheiro ajudaram dom Pedro a criar o Brasil;1822;O segundo volume da premiada trilogia de Laurentino Gomes, dedicado à Independência do Brasil, está de volta às livrarias em uma edição revista e ampliada pela Globo Livros. 1822 traz importantes novidades, como os resultados da exumação dos restos mortais de Dom Pedro e suas duas mulheres oficiais, as imperatrizes Leopoldina e Amélia, realizada em 2012 pela arqueóloga e historiadora Valdirene do Carmo Ambiel, da Universidade de São Paulo.

Os exames ajudaram a esclarecer mistérios na vida desses três personagens. Mostraram, por exemplo, que em consequência de dois acidentes a cavalo, ocorridos no Rio de Janeiro em 1823 e 1829, o imperador havia fraturado quatro costelas do lado esquerdo. Essas fraturas praticamente inutilizaram parte um de seus pulmões, o que pode ter agravado a tuberculose que o matou em 1834.

Em 1822, Laurentino compara diferentes relatos sobre o dia 7 de setembro e a proclamação da independência. Mais do que desmistificar o grito às margens do Ipiranga, o escritor analisa como Dom Pedro conseguiu, apesar de todas as dificuldades, fazer do Brasil uma nação na sequência das mudanças provocadas pela fuga da família real portuguesa em 1808. O autor mostra como as Guerras Napoleônicas, a Revolução Francesa e a independência dos Estados Unidos, entre outros acontecimentos, criaram um ambiente favorável à criação de um novo país nos trópicos.

Laurentino une a pesquisa a um texto leve e saboroso que trata história como um assunto cativante, que nos leva a compreender melhor as origens do Brasil e como problemas estruturais ainda influenciam a nossa realidade hoje. Vencedor do Prêmio Jabuti de Melhor Reportagem e aclamado como Livro do Ano de Não Ficção, 1822 é uma leitura essencial para todos que desejam compreender melhor o nosso país.
1808: Como uma rainha louca, um príncipe medroso e uma corte corrupta enganaram Napoleão e mudaram a História de Portugal e do Brasil;1808;O propósito deste livro, resultado de dez anos de investigação jornalística, é resgatar e contar a história da corte lusitana no Brasil e tentar devolver seus protagonistas à dimensão mais correta possível dos papéis que desempenharam duzentos anos atrás. '1808 - Como uma rainha louca, um príncipe medroso e uma corte corrupta enganaram Napoleão e mudaram a História de Portugal e do Brasil' é o relato sobre um dos principais momentos históricos brasileiros.

História / História do Brasil / História Geral
O diário de Anne Frank;O Diário de Anne Frank;O depoimento da pequena Anne Frank, morta pelos nazistas após passar anos escondida no sótão de uma casa em Amsterdã, ainda hoje emociona leitores no mundo inteiro. Seus diário narra os sentimentos, medos e pequenas alegrias de uma menina judia que, com sua família, lutou em vão para sobreviver ao Holocausto.
Lançado em 1947, O Diário de Anne Frank tronou-se um dos maiores sucessos editoriais de todos os tempos. Um livro tocante e importante que conta às novas gerações os horrores da perseguição aos judeus durante a Segunda Guerra Mundial.
Agora, seis décadas após ter sido escrito, este relato finalmente é publicado na íntegra, com um caderno de fotos e o resgate de trechos que permaneciam inéditos. Uma nova edição que aprofunda e aumenta nossa compreensão da vida e da personalidade dessa menina que se transformou em um dos grandes símbolos da luta contra a opressão e a injustiça. E consagra O Diário de Anne Frank como um dos livros de maior importância do século XX. Uma obra que deve ser lida por todos, para evitar que atrocidades parecidas voltem a acontecer neste mundo.
A guerra não tem rosto de mulher;A Guerra Não Tem Rosto De Mulher;A história das guerras costuma ser contada sob o ponto de vista masculino: soldados e generais, algozes e libertadores. Trata-se, porém, de um equívoco e de uma injustiça. Se em muitos conflitos as mulheres ficaram na retaguarda, em outros estiveram na linha de frente.

É esse capítulo de bravura feminina que Svetlana Aleksiévitch reconstrói neste livro absolutamente apaixonante e forte. Quase um milhão de mulheres lutaram no Exército Vermelho durante a Segunda Guerra Mundial, mas a sua história nunca foi contada. Svetlana Alexiévitch deixa que as vozes dessas mulheres ressoem de forma angustiante e arrebatadora, em memórias que evocam frio, fome, violência sexual e a sombra onipresente da morte.
A História do Mundo Para Quem Tem Pressa;A História do Mundo Para Quem Tem Pressa;É um guia conciso e abrangente, ilustrado por mapas, para tudo o que necessitamos saber sobre os acontecimentos mais importantes da história, desde as antigas civilizações (Suméria, Suméria e Babilônia, por exemplo) até o final da Segunda Guerra Mundial. Esteja o leitor interessado no império de Alexandre, o Grande ou no florescimento da república cartaginesa e sua destruição por Roma na ascensão dos califados árabes ou na dinastia Tang, da China, na Guerra Civil norte-americana ou nos povos maia, inca e asteca, encontrará os fatos essenciais nesta obra igualmente essencial.
Era dos extremos;Era dos Extremos;Ensaio histórico panorâmico em que o célebre historiador inglês desenvolve a tese de que o século XX teve início com a eclosão da Primeira Guerra Mundial, em 1914, e terminou com a derrocada da União Soviética, em 1991.
Eric Hobsbawm, um dos maiores historiadores da atualidade, dá seu testemunho sobre o século XX: "Meu tempo de vida coincide com a maior parte da época de que trata este livro", diz ele na abertura, "por isso até agora me abstive de falar sobre ele". Neste livro fascinante, porém, ele abandona seu silêncio voluntário para contar, em linguagem simples e envolvente, a história da "era das ilusões perdidas".
História da Bruxaria: Feiticeiras, hereges e pagãs;História da Bruxaria: Feiticeiras, hereges e pagãs;Da feitiçaria antiga aos recentes movimentos neopagãos, a história da bruxaria está nas entrelinhas da própria História. As bruxas são um estereótipo duradouro e mutável na mentalidade coletiva. Sua tradição, repleta de perseguições e reviravoltas, tem uma trajetória silenciosa, mas não por isso menos verdadeira e devastadora. História da bruxaria é o mais abrangente estudo sobre o tema, e o discute de forma lúcida e estimulante, sob diferentes perspectivas. Os autores examinam a gênese, o auge e o declínio da caça às bruxas e revelam como a bruxaria sobreviveu, ressurgiu, se reciclou e atua na sociedade contemporânea.
A Ditadura Acabada;A Ditadura Acabada (Coleção Ditadura #5);A mais aclamada obra sobre o regime militar no Brasil chega à conclusão com o livro A ditadura acabada. No quinto volume da Coleção Ditadura, o jornalista Elio Gaspari examina com riqueza de detalhes o período de 1978 a 1985, desde o final do governo do presidente Ernesto Geisel e a posse de seu sucessor, o general João Baptista Figueiredo, até a eleição de Tancredo Neves pelo Colégio Eleitoral. São os anos da abertura política, momento decisivo na história de nosso país e repleto de acontecimentos, como o fim do AI-5, as manifestações políticas pela anistia e pela volta das eleições diretas para a presidência, os atentados promovidos por aqueles que se opunham à redemocratização, como o episódio da bomba no Riocentro em 1981, e uma crise econômica sem precedentes.
